Store,store_name,Group_store,store_longitude,store_latitude,store_address
320,Toocha 175B Cao Thắng,Toocha,106.6755872,10.7747088,"175B Cao Thắng, Phường 12, Quận 10, Thành Phố Hồ Chí Minh, VIỆT NAM"
321,Soya Garden - Lê Văn Sỹ,Soya Garden,106.6792699,10.7872695,"320 Lê Văn Sỹ, Phường 1, Tân Bình, Hồ Chí Minh, Việt Nam"
322,Tocotoco - HH4C Linh Đàm,Tocotoco,105.8260569,20.9635352,"54 - 56, Tòa HH4C Linh Đàm, 56 Linh Đàm, Phường Hoàng Liệt, Quận Hoàng Mai, Hà Nội, VIỆT NAM"
323,Trung Nguyên Legend,Trung Nguyên Legend,105.849734,21.028387,"08 Nhà Chung, Phường Tràng Tiền, Quận Hoàn Kiếm, Hà Nội, VIỆT NAM"
324,Tocotoco - 259 Bạch Mai,Tocotoco,105.8510295,21.0030429,"259 Bạch Mai, Phường Bạch Mai, Quận Hai Bà Trưng, Hà Nội, VIỆT NAM"
325,vivastar99dt1,VIVO COFFEE,106.6589493,10.7826294,"99 Đất Thánh, Phường 6, Quận Tân Bình, Thành Phố Hồ Chí Minh, VIỆT NAM"
326,Royal Tea 111 Nguyễn Thái Học.,ROYAL TEA,106.695474,10.767431,"111 Nguyễn Thái Học, Phường Cầu Ông Lãnh, Quận 1, Thành Phố Hồ Chí Minh, VIỆT NAM"
327,Laha Coffee Khu Công Nghệ Cao Quận 9,LAHA COFFEE,106.7985617,10.8507688,"Lô T2-1.2 Đường D1, Khu Công Nghệ Cao, Phường Tân Phú, Quận 9, Hồ Chí Minh, Việt Nam"
328,Toocha 540 Cách Mạng Tháng 8,Toocha,106.667177,10.785687,"540 Cách Mạng Tháng 8, Phường 11, Quận 3,Thành Phố Hồ CHí Minh, VIỆT NAM"
329,The Cofee House D2,The Coffee House,106.715906,10.805653,"157-157A , Đường D2, Phường 25, Quận Bình Thạnh, Thành Phố Hồ Chí Minh, VIỆT NAM"
330,KOI THÉ PHẠM HỒNG THÁI,KOI Thé,106.696263,10.771402,"24 Phạm Hồng Thái, Phường Bến Thành, Quận 1, Thành Phố Hồ Chí Minh, VIỆT NAM"
331,Phúc Long Coffee & Tea House - Nguyễn Văn Linh Đà Nẵng,Phúc Long Coffee & Tea House,108.2206666,16.0607649,"59-61 Nguyễn Văn Linh, Phường Phước Ninh, Quận Hải Châu, TP. Đà Nẵng"
332,Laha Coffee Phan Xích Long Quận Phú Nhuận,LAHA COFFEE,106.6909608,10.797301,"259 Phan Xích Long, Phường 2, Quận Phú Nhuận, Thành Phố Hồ Chí Minh, VIỆT NAM"
333,CAFE 63 SINCE 1988,CAFE 63,105.848725,21.017005,"63  Trần Nhân Tông, Phường Bùi Thị Xuân, Quận Hai Bà Trưng, Hà Nội, VIỆT NAM"
334,The Coffee House Hồng Hà,The Coffee House,106.6648883,10.813179,"18 Hồng Hà, Phường 2, Quận Tân Bình, Thành Phố Hồ Chí Minh, VIỆT NAM"
335,The Coffee House Phan Đăng Lưu,The Coffee House,106.68386,10.802463,"141 Phan Đăng Lưu, Phường 3, Quận Phú Nhuận, Thành Phố Hồ Chí Minh, VIỆT NAM"
336,Sharetea Cổ Linh,Sharetea,105.8990103,21.026990100000013,"Tầng 1 Aeon Mall Long Biên 27 đường Cổ Linh,, Phường Long Biên, Quận Long Biên, Hà Nội, VIỆT NAM"
337,ROYAL TEA,ROYAL TEA,105.81153700000002,21.011432,"96 Láng Hạ, Phường Láng Hạ, Quận Đống Đa, Hà Nội, VIỆT NAM"
338,Trung Nguyên Legend,Trung Nguyên Legend,105.849734,21.028387,"08 Nhà Chung, Phường Tràng Tiền, Quận Hoàn Kiếm, Hà Nội, VIỆT NAM"
339,Passio - 285CMT8 - VIETTEL,Passio,106.6795138,10.7786801,"285 Cách mạng tháng 8 , Phường 10, Quận 10, Thành Phố Hồ Chí Minh, VIỆT NAM"
340,Sharetea Nguyễn Chí Thanh	,Sharetea,105.806106,21.01693,"78  Nguyễn Chí Thanh, Phường Phương Liên, Quận Đống Đa, Hà Nội, VIỆT NAM"
341,Phúc Long Coffee & Tea House - 122 Lê Lợi,Phúc Long Coffee & Tea House,106.698824,10.772328,"122 Lê Lợi, Phường Bến Thành, Quận 1, Thành Phố Hồ Chí Minh, VIỆT NAM"
342,Phúc Long Coffee & Tea House - Phúc Long GigaMall,Phúc Long Coffee & Tea House,106.72222240000002,10.8283236," số 240-242 Phạm Văn Đồng, P. Hiệp Bình Chánh, Quận Thủ Đức"
343,Toocha Hồ Tùng Mậu,Toocha,106.703796,10.771572,"53   Hồ Tùng Mậu, Phường Bến Nghé, Quận 1, Thành Phố Hồ Chí Minh, VIỆT NAM"
344,Passio - 199 Điện Biên Phủ,Passio,106.698976,10.796756,"199 Điện Biên Phủ, Phường 6, Quận Bình Thạnh, Thành Phố Hồ Chí Minh, VIỆT NAM"
345,thealleynttq7,THE ALLEY,106.6819692,10.7659336,"510 Nguyễn Thị Thập, Phường Tân Quy, Quận 7, Thành Phố Hồ Chí Minh, VIỆT NAM"
346,Tocotoco - 60 Hồ Tùng Mậu,Tocotoco,105.7777619,21.0368122,"60 Hồ Tùng Mậu, Phường Mai Dịch, Quận Cầu Giấy, Hà Nội, VIỆT NAM"
347,Phúc Long Coffee & Tea House - Đinh Tiên Hoàng,Phúc Long Coffee & Tea House,106.695683,10.791907,"179 Đinh Tiên Hoàng, Phường Tân Định, Quận 1, Thành Phố Hồ Chí Minh, VIỆT NAM"
348,BA LÁ TRÀ 74 NGUYỄN CƠ THẠCH,BA LÁ TRÀ,106.7242277,10.7716334,"Tòa nhà Sarimi số 74 Nguyễn Cơ Thạch, Phường An Lợi Đông, Quận 2, Thành Phố Hồ Chí Minh, VIỆT NAM"
349,Toocha An Dương Vương,Toocha,106.675913,10.758061,"477   An Dương Vương, Phường 3, Quận 5, Thành Phố Hồ Chí Minh, VIỆT NAM"
350,The Coffee House Kim Mã,The Coffee House,105.8199323,21.031234,"259 Kim Mã, Q.Ba Đình, Hà Nội, Việt Nam"
351,YiFang Taiwan Fruit Tea- 11 Thanh niên,YiFang Tea,105.83621399999998,21.0435439,"11 Thanh Niên, Phường Quán Thánh, Quận Ba Đình, Hà Nội, VIỆT NAM"
352,Share Tea Nguyễn Huệ,Sharetea,106.703673,10.773694,"113 	 Nguyễn Huệ, Phường Bến Nghé, Quận 1, Thành Phố Hồ Chí Minh, VIỆT NAM"
353,Phúc Long Coffee & Tea House - 325 Lý Tự Trọng,Phúc Long Coffee & Tea House,106.693686,10.771479,"325 Lý Tự Trọng, Phường Bến Thành, Quận 1, Thành Phố Hồ Chí Minh, VIỆT NAM"
354,Trung Nguyên Legend,Trung Nguyên Legend,105.849734,21.028387,"08 Nhà Chung, Phường Tràng Tiền, Quận Hoàn Kiếm, Hà Nội, VIỆT NAM"
355,Trung Nguyên Legend,Trung Nguyên Legend,105.849734,21.028387,"08 Nhà Chung, Phường Tràng Tiền, Quận Hoàn Kiếm, Hà Nội, VIỆT NAM"
356,The Coffee House Nguyễn Văn Lượng,The Coffee House,106.6691913,10.838822,"258 Nguyễn Văn Lượng, P.17, Q.Gò Vấp, Thành Phố Hồ Chí Minh, Việt Nam"
357,KOI THÉ NGUYỄN ĐỨC CẢNH,KOI Thé,106.708585,10.727897,"157 Nguyễn Đức Cảnh, Phường Tân Phong, Quận 7, Thành Phố Hồ Chí Minh, VIỆT NAM"
358,CÀ PHÊ MILANO HIMLAM.,CAFE MILANO,106.6994736,10.744957,"B5 Đường 4D KDC Him Lam, Phường Tân Hưng, Quận 7, Thành Phố Hồ Chí Minh, VIỆT NAM"
359,Gong Cha Vinh,Gongcha,105.6773999,18.6765424,"1 Lê Hồng Phong, Phường Hưng Bình, Thành phố Vinh, Nghệ An, VIỆT NAM"
360,Gong Cha Phan Xích Long,Gongcha,106.6838781,10.8010423,"160 Phan Xích Long, phường 2, Phú Nhuận, Hồ Chí Minh, Việt Nam"
361,LaHa Coffee Đinh Tiên Hoàng Quận Bình Thạnh,LAHA COFFEE,106.6940652,10.7998172,"127g Đinh Tiên Hoàng, Phường 3, Quận Bình Thạnh, Thành Phố Hồ Chí Minh, VIỆT NAM"
362,Effoc Coffee Lũy Bán Bích,Effoc Coffee,106.635876,10.781547,"691 Luỹ Bán Bích, Phường Phú Thọ Hòa, Quận Tân Phú, Thành Phố Hồ Chí Minh, VIỆT NAM"
363,Tocotoco - 23 Tôn Đản,Tocotoco,106.707797,10.761245,"23 Tôn Đản, Phường 13, Quận 4, Thành Phố Hồ Chí Minh, VIỆT NAM"
364,Sharetea Sư Vạn Hạnh,Sharetea,106.670403,10.770227,"353 Sư Vạn Hạnh, Phường 12, Quận 10, Thành Phố Hồ Chí Minh, VIỆT NAM"
365,The Coffee House Nguyễn Thị Thập,The Coffee House,106.7131079,10.738242800000002,"313 Nguyễn Thị Thập, P.Tân Phú, Q.7, Thành Phố Hồ Chí Minh, Việt Nam"
366,Phúc Long Coffee & Tea House - 382 Trần Hưng Đạo,Phúc Long Coffee & Tea House,106.660805,10.752193,"382 Trần Hưng Đạo, Phường 11, Quận 5, Thành Phố Hồ Chí Minh, VIỆT NAM"
367,Royal Tea Ngọc Khánh,ROYAL TEA,105.817836,21.0256909,"14 Ngọc Khánh, Ngọc Khánh, Ba Đình, Hà Nội, Việt Nam"
368,Gongcha Masteri,Gongcha,106.7419092,10.8024013,"Shop house 8, tầng trệt toà nhà B tháp T5 Masteri, 159 Xa Lộ Hà Nội, Phường Thảo Điền, Quận 2, Thành Phố Hồ Chí Minh, VIỆT NAM"
